{
  "character_slug": "terry",
  "schema_version": "3.0.0",
  "export_contract_version": "3.0.0",
  "derivation_rule_version": "1.0.0",
  "repo_generation_registry_version": "2.1.0",
  "repo_generation_registry_sha256": "779ea03614ea292ae534666ef228f1d2db844faa09d657284c2a0da429f3cbba",
  "repo_generation_binding_policy_version": "1.0.0",
  "repo_generation_binding_policy_sha256": "d6e3d721717fc2d6e93f852c6767758efc40f2db32d82b734998176191e244ec",
  "datasets": {
    "official_raw": {
      "publication_state": "available",
      "published_run_id": "20260412T161633880923Z-93e5fd8b",
      "published_snapshot_ids": [
        "20260412T161523Z-fc92d323"
      ],
      "published_record_count": 61,
      "withheld_review_count": 5,
      "registry_version": "2.1.0",
      "registry_sha256": "3082c3e19c241c5539611126ba13fdd245153e68117756fe5245ecf88076b614",
      "binding_policy_version": null,
      "binding_policy_sha256": null,
      "content_hash": "755240feeccabf28c5459748b5c4e325ba5ab74a74f50d66007d8b1fa22c00de"
    },
    "supercombo_enrichment": {
      "publication_state": "available",
      "published_run_id": "20260412T213443076506Z-09c4b00d",
      "published_snapshot_ids": [
        "20260412T213442Z-a27a5cb6"
      ],
      "published_record_count": 50,
      "withheld_review_count": 16,
      "registry_version": "2.1.0",
      "registry_sha256": "779ea03614ea292ae534666ef228f1d2db844faa09d657284c2a0da429f3cbba",
      "binding_policy_version": "1.0.0",
      "binding_policy_sha256": "d6e3d721717fc2d6e93f852c6767758efc40f2db32d82b734998176191e244ec",
      "content_hash": "dcc9e8fcab794d73c46dfaef9158a70bb06b62f17f05934ba4b829b20dd0ae3f"
    },
    "derived_metrics": {
      "publication_state": "available",
      "published_run_id": "20260412T161633880923Z-93e5fd8b",
      "published_snapshot_ids": [
        "20260412T161523Z-fc92d323"
      ],
      "published_record_count": 61,
      "withheld_review_count": 5,
      "registry_version": "2.1.0",
      "registry_sha256": "3082c3e19c241c5539611126ba13fdd245153e68117756fe5245ecf88076b614",
      "binding_policy_version": null,
      "binding_policy_sha256": null,
      "content_hash": "f49b9aa55bf9c14e1ee07e6c198e2f73056974e007bc8848dcd4adc75f2c39e1"
    }
  }
}
