{
  "character_slug": "elena",
  "schema_version": "3.0.0",
  "export_contract_version": "3.0.0",
  "derivation_rule_version": "1.0.0",
  "repo_generation_registry_version": "2.1.0",
  "repo_generation_registry_sha256": "42b479c522e85eaa4fbb6cc4cd52ebf3470ea008c017991bb2e2499b9d52e1d7",
  "repo_generation_binding_policy_version": "1.0.0",
  "repo_generation_binding_policy_sha256": "0ea01cc6b3af58191618860a69880c914a5a206d5d5aa604bb34c0c65a45f1bb",
  "datasets": {
    "official_raw": {
      "publication_state": "available",
      "published_run_id": "20260412T161634113045Z-76b94746",
      "published_snapshot_ids": [
        "20260412T161524Z-2649b57a"
      ],
      "published_record_count": 59,
      "withheld_review_count": 20,
      "registry_version": "2.1.0",
      "registry_sha256": "7b4ca2e638f2bdd57d8fc4e903cde711253a8334d9363d882156b05ae96db030",
      "binding_policy_version": null,
      "binding_policy_sha256": null,
      "content_hash": "2a1e560afd7da5123e81018ed969ae8021a7f1afc028660a3ecf0650958a56b2"
    },
    "supercombo_enrichment": {
      "publication_state": "available",
      "published_run_id": "20260412T214050987636Z-21794606",
      "published_snapshot_ids": [
        "20260412T214050Z-b474cc50"
      ],
      "published_record_count": 42,
      "withheld_review_count": 40,
      "registry_version": "2.1.0",
      "registry_sha256": "42b479c522e85eaa4fbb6cc4cd52ebf3470ea008c017991bb2e2499b9d52e1d7",
      "binding_policy_version": "1.0.0",
      "binding_policy_sha256": "0ea01cc6b3af58191618860a69880c914a5a206d5d5aa604bb34c0c65a45f1bb",
      "content_hash": "aebfd047aab0153354a554c391330fa258726dc7dca5ab108f55f659c86903a3"
    },
    "derived_metrics": {
      "publication_state": "available",
      "published_run_id": "20260412T161634113045Z-76b94746",
      "published_snapshot_ids": [
        "20260412T161524Z-2649b57a"
      ],
      "published_record_count": 59,
      "withheld_review_count": 20,
      "registry_version": "2.1.0",
      "registry_sha256": "7b4ca2e638f2bdd57d8fc4e903cde711253a8334d9363d882156b05ae96db030",
      "binding_policy_version": null,
      "binding_policy_sha256": null,
      "content_hash": "2a68d672a7dc3fcd791780567fbbb6f7b8f0c4ccb3595a05ec25304106a3336f"
    }
  }
}
