{
  "character_slug": "lily",
  "schema_version": "3.0.0",
  "export_contract_version": "3.0.0",
  "derivation_rule_version": "1.0.0",
  "repo_generation_registry_version": "2.1.0",
  "repo_generation_registry_sha256": "e963fa8a29b5bc94baa71da47d7ea164e3647d63a1e4305accd894d480e4d84e",
  "repo_generation_binding_policy_version": "1.0.0",
  "repo_generation_binding_policy_sha256": "9886e83bd129e32c63eebe12606d80ce7e1f1e0ac629f1e0744f01ea3f2e7a29",
  "datasets": {
    "official_raw": {
      "publication_state": "available",
      "published_run_id": "20260412T161633290127Z-92ea3b61",
      "published_snapshot_ids": [
        "20260412T161519Z-400d530c"
      ],
      "published_record_count": 53,
      "withheld_review_count": 21,
      "registry_version": "2.1.0",
      "registry_sha256": "54172a2b603959534fc281b74504e3b806dde75ad5ed8d79b93398ce3b81189a",
      "binding_policy_version": null,
      "binding_policy_sha256": null,
      "content_hash": "2e1e3ba8da0e2dbc18957598f1013c6fed2d2db24009ac5e620fe1334cb49512"
    },
    "supercombo_enrichment": {
      "publication_state": "unavailable",
      "published_run_id": null,
      "published_snapshot_ids": [],
      "published_record_count": 0,
      "withheld_review_count": 0,
      "registry_version": "2.1.0",
      "registry_sha256": "e963fa8a29b5bc94baa71da47d7ea164e3647d63a1e4305accd894d480e4d84e",
      "binding_policy_version": "1.0.0",
      "binding_policy_sha256": "9886e83bd129e32c63eebe12606d80ce7e1f1e0ac629f1e0744f01ea3f2e7a29",
      "content_hash": null
    },
    "derived_metrics": {
      "publication_state": "available",
      "published_run_id": "20260412T161633290127Z-92ea3b61",
      "published_snapshot_ids": [
        "20260412T161519Z-400d530c"
      ],
      "published_record_count": 53,
      "withheld_review_count": 21,
      "registry_version": "2.1.0",
      "registry_sha256": "54172a2b603959534fc281b74504e3b806dde75ad5ed8d79b93398ce3b81189a",
      "binding_policy_version": null,
      "binding_policy_sha256": null,
      "content_hash": "48cc3f828f482fc14d656f33eae3175a59d1443ab199b58dcc04eb103f23838f"
    }
  }
}
