{
  "character_slug": "cviper",
  "schema_version": "3.0.0",
  "export_contract_version": "3.0.0",
  "derivation_rule_version": "1.0.0",
  "repo_generation_registry_version": "2.1.0",
  "repo_generation_registry_sha256": "87a7011e28b3b35e563ac3e3b9bd07503e9b303c30b80616fa30b326cb8568cc",
  "repo_generation_binding_policy_version": "1.0.0",
  "repo_generation_binding_policy_sha256": "919dbc6bf4a0e1bcf6567fe340aae4b6d6f64b88f04e2769d6f73d434841ae86",
  "datasets": {
    "official_raw": {
      "publication_state": "available",
      "published_run_id": "20260412T161634287623Z-3e983212",
      "published_snapshot_ids": [
        "20260412T161525Z-a7ba6579"
      ],
      "published_record_count": 58,
      "withheld_review_count": 11,
      "registry_version": "2.1.0",
      "registry_sha256": "055231c5b8c661d57070cebfef6926ff1d3bb97ba63aa970b9adc98bed490f83",
      "binding_policy_version": null,
      "binding_policy_sha256": null,
      "content_hash": "bf3e09f685da04b96371ba269c897174b9b2bc2bc3bdc70b5e24104a7af37974"
    },
    "supercombo_enrichment": {
      "publication_state": "available",
      "published_run_id": "20260412T214748703789Z-83b88bdb",
      "published_snapshot_ids": [
        "20260412T214259Z-d1544e78"
      ],
      "published_record_count": 43,
      "withheld_review_count": 21,
      "registry_version": "2.1.0",
      "registry_sha256": "87a7011e28b3b35e563ac3e3b9bd07503e9b303c30b80616fa30b326cb8568cc",
      "binding_policy_version": "1.0.0",
      "binding_policy_sha256": "919dbc6bf4a0e1bcf6567fe340aae4b6d6f64b88f04e2769d6f73d434841ae86",
      "content_hash": "a1e9e9394cb3094feaac9fedb681b158eafd9740c0c7c0da93be33ca5884cab6"
    },
    "derived_metrics": {
      "publication_state": "available",
      "published_run_id": "20260412T161634287623Z-3e983212",
      "published_snapshot_ids": [
        "20260412T161525Z-a7ba6579"
      ],
      "published_record_count": 58,
      "withheld_review_count": 11,
      "registry_version": "2.1.0",
      "registry_sha256": "055231c5b8c661d57070cebfef6926ff1d3bb97ba63aa970b9adc98bed490f83",
      "binding_policy_version": null,
      "binding_policy_sha256": null,
      "content_hash": "26d308560c51a03a0a66ac64d1077c91fe3ab6151394870e4952cc503b774815"
    }
  }
}
